[
  {
    "queue_id": "d1e2f3a0-0000-4000-8000-000000000010",
    "tenant_id": "pk-test-agency-001",
    "lead_id": "b7e2c2b0-1234-4a1a-9d3d-0000000000e1",
    "draft_subject": "Property Enquiry — residential in DHA Phase 6",
    "draft_body": "Dear Ali Raza, ...",
    "recipient_email": "ali.raza@example.com",
    "queued_at": "2026-08-03T11:40:00+00:00",
    "approved": false,
    "approved_at": null,
    "sent_at": null,
    "re_notified": false,
    "auto_archived": false,
    "rejected": false
  },
  {
    "queue_id": "d1e2f3a0-0000-4000-8000-000000000011",
    "tenant_id": "pk-test-agency-001",
    "lead_id": "b7e2c2b0-1234-4a1a-9d3d-0000000000e2",
    "draft_subject": "Property Enquiry — commercial in Gulberg III",
    "draft_body": "Dear Sana Khan, ...",
    "recipient_email": "sana.khan@example.com",
    "queued_at": "2026-08-03T08:00:00+00:00",
    "approved": true,
    "approved_at": "2026-08-03T08:30:00+00:00",
    "sent_at": "2026-08-03T08:30:05+00:00",
    "re_notified": false,
    "auto_archived": false,
    "rejected": false
  },
  {
    "queue_id": "d1e2f3a0-0000-4000-8000-000000000012",
    "tenant_id": "pk-test-agency-001",
    "lead_id": "b7e2c2b0-1234-4a1a-9d3d-0000000000e3",
    "draft_subject": "Property Enquiry — plot in Bahria Town",
    "draft_body": "Dear Bilal Ahmed, ...",
    "recipient_email": "bilal.ahmed@example.com",
    "queued_at": "2026-08-03T07:00:00+00:00",
    "approved": true,
    "approved_at": "2026-08-03T07:35:00+00:00",
    "sent_at": null,
    "re_notified": false,
    "auto_archived": false,
    "rejected": false
  },
  {
    "queue_id": "d1e2f3a0-0000-4000-8000-000000000013",
    "tenant_id": "pk-test-agency-001",
    "lead_id": "b7e2c2b0-1234-4a1a-9d3d-0000000000e4",
    "draft_subject": "Property Enquiry — rental in Clifton",
    "draft_body": "Dear Sir/Madam, ...",
    "recipient_email": "unknown-contact@example.com",
    "queued_at": "2026-08-03T06:00:00+00:00",
    "approved": false,
    "approved_at": null,
    "sent_at": null,
    "re_notified": false,
    "auto_archived": false,
    "rejected": true
  },
  {
    "queue_id": "d1e2f3a0-0000-4000-8000-000000000014",
    "tenant_id": "pk-test-agency-001",
    "lead_id": "b7e2c2b0-1234-4a1a-9d3d-0000000000e5",
    "draft_subject": "Property Enquiry — residential in Model Town",
    "draft_body": "Dear Sir/Madam, ...",
    "recipient_email": "stale-contact@example.com",
    "queued_at": "2026-08-02T09:00:00+00:00",
    "approved": false,
    "approved_at": null,
    "sent_at": null,
    "re_notified": true,
    "auto_archived": true,
    "rejected": false
  }
]
