[
  {
    "queue_id": "d1e2f3a0-0000-4000-8000-000000000001",
    "tenant_id": "pk-test-agency-001",
    "lead_id": "b7e2c2b0-1234-4a1a-9d3d-0000000000e1",
    "draft_subject": "Property Enquiry — residential in DHA Phase 6",
    "draft_body": "Dear Ali Raza,\n\nThank you for your interest in properties in DHA Phase 6.",
    "recipient_email": "ali.raza@example.com",
    "queued_at": "2026-08-03T11:40:00+00:00",
    "approved": false,
    "approved_at": null,
    "sent_at": null,
    "re_notified": false,
    "auto_archived": false,
    "rejected": false
  }
]
