[
  {
    "queue_id": "d1e2f3a0-0000-4000-8000-000000000020",
    "tenant_id": "pk-test-agency-001",
    "lead_id": "b7e2c2b0-1234-4a1a-9d3d-0000000000c0",
    "draft_subject": "Property Enquiry — residential in Sector 0",
    "draft_body": "Dear Sir/Madam, ...",
    "recipient_email": "lead0@example.com",
    "queued_at": "2026-08-03T01:00:00+00:00",
    "approved": false,
    "approved_at": null,
    "sent_at": null,
    "re_notified": false,
    "auto_archived": false,
    "rejected": false
  },
  {
    "queue_id": "d1e2f3a0-0000-4000-8000-000000000021",
    "tenant_id": "pk-test-agency-001",
    "lead_id": "b7e2c2b0-1234-4a1a-9d3d-0000000000c1",
    "draft_subject": "Property Enquiry — residential in Sector 1",
    "draft_body": "Dear Sir/Madam, ...",
    "recipient_email": "lead1@example.com",
    "queued_at": "2026-08-03T02:00:00+00:00",
    "approved": false,
    "approved_at": null,
    "sent_at": null,
    "re_notified": false,
    "auto_archived": false,
    "rejected": false
  },
  {
    "queue_id": "d1e2f3a0-0000-4000-8000-000000000022",
    "tenant_id": "pk-test-agency-001",
    "lead_id": "b7e2c2b0-1234-4a1a-9d3d-0000000000c2",
    "draft_subject": "Property Enquiry — residential in Sector 2",
    "draft_body": "Dear Sir/Madam, ...",
    "recipient_email": "lead2@example.com",
    "queued_at": "2026-08-03T03:00:00+00:00",
    "approved": false,
    "approved_at": null,
    "sent_at": null,
    "re_notified": false,
    "auto_archived": false,
    "rejected": false
  },
  {
    "queue_id": "d1e2f3a0-0000-4000-8000-000000000023",
    "tenant_id": "pk-test-agency-001",
    "lead_id": "b7e2c2b0-1234-4a1a-9d3d-0000000000c3",
    "draft_subject": "Property Enquiry — residential in Sector 3",
    "draft_body": "Dear Sir/Madam, ...",
    "recipient_email": "lead3@example.com",
    "queued_at": "2026-08-03T04:00:00+00:00",
    "approved": false,
    "approved_at": null,
    "sent_at": null,
    "re_notified": false,
    "auto_archived": false,
    "rejected": false
  },
  {
    "queue_id": "d1e2f3a0-0000-4000-8000-000000000024",
    "tenant_id": "pk-test-agency-001",
    "lead_id": "b7e2c2b0-1234-4a1a-9d3d-0000000000c4",
    "draft_subject": "Property Enquiry — residential in Sector 4",
    "draft_body": "Dear Sir/Madam, ...",
    "recipient_email": "lead4@example.com",
    "queued_at": "2026-08-03T05:00:00+00:00",
    "approved": false,
    "approved_at": null,
    "sent_at": null,
    "re_notified": false,
    "auto_archived": false,
    "rejected": false
  },
  {
    "queue_id": "d1e2f3a0-0000-4000-8000-000000000025",
    "tenant_id": "pk-test-agency-001",
    "lead_id": "b7e2c2b0-1234-4a1a-9d3d-0000000000c5",
    "draft_subject": "Property Enquiry — residential in Sector 5",
    "draft_body": "Dear Sir/Madam, ...",
    "recipient_email": "lead5@example.com",
    "queued_at": "2026-08-03T06:00:00+00:00",
    "approved": false,
    "approved_at": null,
    "sent_at": null,
    "re_notified": false,
    "auto_archived": false,
    "rejected": false
  },
  {
    "queue_id": "d1e2f3a0-0000-4000-8000-000000000026",
    "tenant_id": "pk-test-agency-001",
    "lead_id": "b7e2c2b0-1234-4a1a-9d3d-0000000000c6",
    "draft_subject": "Property Enquiry — residential in Sector 6",
    "draft_body": "Dear Sir/Madam, ...",
    "recipient_email": "lead6@example.com",
    "queued_at": "2026-08-03T07:00:00+00:00",
    "approved": false,
    "approved_at": null,
    "sent_at": null,
    "re_notified": false,
    "auto_archived": false,
    "rejected": false
  },
  {
    "queue_id": "d1e2f3a0-0000-4000-8000-000000000027",
    "tenant_id": "pk-test-agency-001",
    "lead_id": "b7e2c2b0-1234-4a1a-9d3d-0000000000c7",
    "draft_subject": "Property Enquiry — residential in Sector 7",
    "draft_body": "Dear Sir/Madam, ...",
    "recipient_email": "lead7@example.com",
    "queued_at": "2026-08-03T08:00:00+00:00",
    "approved": false,
    "approved_at": null,
    "sent_at": null,
    "re_notified": false,
    "auto_archived": false,
    "rejected": false
  },
  {
    "queue_id": "d1e2f3a0-0000-4000-8000-000000000028",
    "tenant_id": "pk-test-agency-001",
    "lead_id": "b7e2c2b0-1234-4a1a-9d3d-0000000000c8",
    "draft_subject": "Property Enquiry — residential in Sector 8",
    "draft_body": "Dear Sir/Madam, ...",
    "recipient_email": "lead8@example.com",
    "queued_at": "2026-08-03T09:00:00+00:00",
    "approved": false,
    "approved_at": null,
    "sent_at": null,
    "re_notified": false,
    "auto_archived": false,
    "rejected": false
  },
  {
    "queue_id": "d1e2f3a0-0000-4000-8000-000000000029",
    "tenant_id": "pk-test-agency-001",
    "lead_id": "b7e2c2b0-1234-4a1a-9d3d-0000000000c9",
    "draft_subject": "Property Enquiry — residential in Sector 9",
    "draft_body": "Dear Sir/Madam, ...",
    "recipient_email": "lead9@example.com",
    "queued_at": "2026-08-03T10:00:00+00:00",
    "approved": false,
    "approved_at": null,
    "sent_at": null,
    "re_notified": false,
    "auto_archived": false,
    "rejected": false
  },
  {
    "queue_id": "d1e2f3a0-0000-4000-8000-000000000030",
    "tenant_id": "pk-test-agency-001",
    "lead_id": "b7e2c2b0-1234-4a1a-9d3d-0000000000c10",
    "draft_subject": "Property Enquiry — residential in Sector 10",
    "draft_body": "Dear Sir/Madam, ...",
    "recipient_email": "lead10@example.com",
    "queued_at": "2026-08-03T11:00:00+00:00",
    "approved": false,
    "approved_at": null,
    "sent_at": null,
    "re_notified": false,
    "auto_archived": false,
    "rejected": false
  }
]